{
  "kind": "code_review",
  "schema_version": "code-review:v1",
  "id": "ST-PR-MERGE-code-review-20261010053843054-b3262c",
  "story_id": "ST-PR-MERGE",
  "delivery_id": "PR-MERGE",
  "delivery_profile_id": "AUT-PR-MERGE",
  "repository": "github.com/aantenore/agentic-sdlc",
  "base_branch": "main",
  "head_branch": "codex/pr-1",
  "base_sha": "990ba7b3b4611c6380394e5d03cffb0b0de4ff78",
  "reviewed_head_sha": "a2840f7132a28c07c04f1b8efb072035bf408abe",
  "commit_authors": [
    {
      "name": "Autonomy E2E",
      "email": "autonomy-e2e@example.invalid"
    }
  ],
  "reviewer": {
    "actor_id": "independent-reviewer",
    "actor_type": "human",
    "git_name": "Independent Reviewer",
    "git_email": "independent-reviewer@example.invalid"
  },
  "verdict": "approved",
  "findings": [],
  "summary": "Code review of PR-MERGE at a2840f7132a2: approved",
  "reviewed_at": "2026-10-10T05:38:43.054Z",
  "requirement_ids": [],
  "actor": {
    "id": "independent-reviewer",
    "type": "human",
    "name": "Independent Reviewer",
    "email": "independent-reviewer@example.invalid",
    "source": "cli"
  },
  "git": {
    "is_git_repo": true,
    "branch": "codex/pr-1",
    "head_sha": "a2840f7132a28c07c04f1b8efb072035bf408abe",
    "is_dirty": true,
    "user": {
      "name": "Independent Reviewer",
      "email": "independent-reviewer@example.invalid"
    },
    "remotes": [
      "origin"
    ]
  },
  "run": {
    "run_id": null,
    "thread_id": null,
    "session_id": null,
    "tool": "agentic-sdlc-cli",
    "version": "0.101.0"
  },
  "created_at": "2026-10-10T05:38:43.054Z",
  "audit": {
    "created_by": {
      "id": "independent-reviewer",
      "type": "human",
      "name": "Independent Reviewer",
      "email": "independent-reviewer@example.invalid",
      "source": "cli"
    },
    "git": {
      "is_git_repo": true,
      "branch": "codex/pr-1",
      "head_sha": "a2840f7132a28c07c04f1b8efb072035bf408abe",
      "is_dirty": true,
      "user": {
        "name": "Independent Reviewer",
        "email": "independent-reviewer@example.invalid"
      },
      "remotes": [
        "origin"
      ]
    },
    "run": {
      "run_id": null,
      "thread_id": null,
      "session_id": null,
      "tool": "agentic-sdlc-cli",
      "version": "0.101.0"
    }
  },
  "hash_algorithm": "sha256:stable-json:v1",
  "record_hash": "ba194016e030f90edc1fc6614a7696ee96f53ec837c6a8cc30963e36ab08b04f"
}
